{
  "schemaVersion": "1.0.0",
  "requestId": "req-20260714-0005",
  "traceId": "trc-20260714-0005",
  "eventId": "evt-20260714-0005",
  "lineId": "mooring-05",
  "siteId": "yard-a",
  "berthId": "berth-01",
  "bollardId": "bollard-05",
  "vesselId": "vessel-02",
  "riskLevel": "DANGER",
  "riskScore": 0.9215,
  "classProbabilities": { "NORMAL": 0.0, "CAUTION": 0.0, "DANGER": 1.0 },
  "modelVersion": "ae-port-window-xgb-v1-20260713+piezo-frequency-policy-v1",
  "features": {
    "amplitudeDbAe": 91.99,
    "freqLowKhz": 25.37,
    "freqHighKhz": 198.33,
    "durationMs": 3.55,
    "hitCount": 26,
    "snrDb": 57.6,
    "signalType": "High amplitude"
  },
  "context": {
    "ambientNoiseDb": 40.0,
    "rainMmh": 0.0,
    "windMps": 0.0,
    "craneActive": 0,
    "sensorKind": "piezo",
    "structuralFreqHz": 30.8,
    "loadRatio": 0.9215
  }
}
